{
  "contract_version": "0.1.0",
  "task_type": "code-review",
  "status": "completed",
  "summary": "Code review completed with profile-scoped read-only tools.",
  "artifacts": [
    {
      "kind": "tool-output",
      "uri": "hetzner://runtime/tool_outputs/run-code-review/tool-git-read-output.json"
    }
  ],
  "details": {
    "findings": [],
    "reviewed_artifacts": [
      {
        "kind": "tool-output",
        "uri": "hetzner://runtime/tool_outputs/run-code-review/tool-git-read-output.json"
      }
    ]
  }
}
